{
  "schema_version": "1.0.0",
  "id": "A-S5O-22",
  "exact_title": "limited enable 后 divergence diagnostics 仍可查询",
  "kind": "acceptance",
  "roles": [
    "acceptance"
  ],
  "lane": "acceptance",
  "lifecycle": "not_started",
  "revision": 0,
  "optional": false,
  "blocked": false,
  "hold": false,
  "change_surfaces": [],
  "source_refs": [
    {
      "path": "docs/AgentGuard_Runtime_Supervision_Console_Design/04_三线阶段实施_PR拆分与验收.md",
      "heading": "### 11.3 S5-O 退出条件和口径",
      "line_hint": 572
    }
  ],
  "evidence_refs": [],
  "acceptance_parent": "S5O",
  "work": null,
  "notes": []
}
