{
  "schema_version": "1.0.0",
  "id": "R03",
  "exact_title": "PR-RTE-03 — OpenClaw Terminal Outcome Closure",
  "kind": "task",
  "roles": [
    "task"
  ],
  "lane": "rte",
  "lifecycle": "completed",
  "revision": 1,
  "optional": false,
  "blocked": false,
  "hold": false,
  "change_surfaces": [],
  "source_refs": [
    {
      "path": "docs/AgentGuard_Runtime_Enforcement_Contract_v1_Final/06_迁移_PR与实施计划.md",
      "heading": "## 5. PR-RTE-03 — OpenClaw Terminal Outcome Closure",
      "line_hint": 104
    }
  ],
  "evidence_refs": [
    "evidence/R03/EV-R03-COMMIT.json"
  ],
  "work": null,
  "notes": []
}
