{
  "schema_version": "1.0.0",
  "id": "A-S0-05",
  "exact_title": "Pure Mock 使用固定页级水印；Hybrid 才逐元素标来源",
  "kind": "acceptance",
  "roles": [
    "acceptance"
  ],
  "lane": "acceptance",
  "lifecycle": "completed",
  "revision": 1,
  "optional": false,
  "blocked": false,
  "hold": false,
  "change_surfaces": [],
  "source_refs": [
    {
      "path": "docs/AgentGuard_Runtime_Supervision_Console_Design/04_三线阶段实施_PR拆分与验收.md",
      "heading": "### 6.3 退出条件",
      "line_hint": 296
    }
  ],
  "evidence_refs": [
    "evidence/A-S0-05/EV-A-S0-05-COMMIT.json"
  ],
  "acceptance_parent": "S0",
  "work": null,
  "notes": []
}
