{
  "schema_version": "1.0.0",
  "id": "A-RTEP0-05",
  "exact_title": "deny→0 invocation",
  "kind": "acceptance",
  "roles": [
    "acceptance"
  ],
  "lane": "acceptance",
  "lifecycle": "completed",
  "revision": 1,
  "optional": false,
  "blocked": false,
  "hold": false,
  "change_surfaces": [],
  "source_refs": [
    {
      "path": "docs/AgentGuard_Runtime_Enforcement_Contract_v1_Final/06_迁移_PR与实施计划.md",
      "heading": "## 13. P0 完成定义",
      "line_hint": 310
    }
  ],
  "evidence_refs": [
    "evidence/A-RTEP0-05/EV-A-RTEP0-05-COMMIT.json"
  ],
  "acceptance_parent": "RTE-P0-DOD",
  "work": null,
  "notes": []
}
