{
  "blocked": false,
  "change_surfaces": [
    "core-evaluation-activation"
  ],
  "evidence_refs": [],
  "exact_title": "LGV2-C — Core selector, three modes and official evidence",
  "hold": false,
  "id": "LGV2-C",
  "kind": "task",
  "lane": "core",
  "lifecycle": "in_progress",
  "notes": [
    "Competition-only V2 authority extension; it does not complete formal C11, Gate B or S5-O."
  ],
  "optional": false,
  "revision": 1,
  "roles": [
    "task"
  ],
  "schema_version": "1.0.0",
  "source_refs": [
    {
      "heading": "### LGV2-C — Core selector、三态与 official evidence",
      "line_hint": 35,
      "path": "docs/06_delivery/LangGraph_Competition_V2_Official_Implementation.md"
    }
  ],
  "work": {
    "base_sha": "aee332d81e92cab29566618c38c1eea9a5989a4e",
    "branch": "codex/LGV2-C-core",
    "owner": "codex-root",
    "started_at": "2026-08-17T14:11:53Z",
    "substate": "active",
    "worktree_slug": "LGV2-C"
  }
}
