{
  "schema_version": "1.0.0",
  "id": "A-S0-07",
  "exact_title": "CT 内容入口 Preview 只出现在 MOCK PREVIEW 数据源，Live 缺字段显示 unavailable",
  "kind": "acceptance",
  "roles": [
    "acceptance"
  ],
  "lane": "acceptance",
  "lifecycle": "completed",
  "revision": 1,
  "optional": false,
  "blocked": false,
  "hold": false,
  "change_surfaces": [],
  "source_refs": [
    {
      "path": "docs/AgentGuard_Runtime_Supervision_Console_Design/04_三线阶段实施_PR拆分与验收.md",
      "heading": "### 6.3 退出条件",
      "line_hint": 298
    }
  ],
  "evidence_refs": [
    "evidence/A-S0-07/EV-A-S0-07-COMMIT.json"
  ],
  "acceptance_parent": "S0",
  "work": null,
  "notes": []
}
