{
  "schema_version": "1.0.0",
  "id": "A-GSTAGE-04",
  "exact_title": "契约、存储、前端和真实 E2E 证据齐全",
  "kind": "acceptance",
  "roles": [
    "acceptance"
  ],
  "lane": "acceptance",
  "lifecycle": "not_started",
  "revision": 0,
  "optional": false,
  "blocked": false,
  "hold": false,
  "change_surfaces": [],
  "source_refs": [
    {
      "path": "docs/AgentGuard_Runtime_Supervision_Console_Design/04_三线阶段实施_PR拆分与验收.md",
      "heading": "## 16. Stage 晋级判定",
      "line_hint": 762
    }
  ],
  "evidence_refs": [],
  "acceptance_parent": "G-STAGE",
  "work": null,
  "notes": []
}
