{
  "schema_version": "1.0.0",
  "id": "A-GADD-10",
  "exact_title": "口径：允许/禁止展示语言写入 Stage 验收",
  "kind": "acceptance",
  "roles": [
    "acceptance"
  ],
  "lane": "acceptance",
  "lifecycle": "not_started",
  "revision": 0,
  "optional": false,
  "blocked": false,
  "hold": false,
  "change_surfaces": [],
  "source_refs": [
    {
      "path": "docs/AgentGuard_Runtime_Supervision_Console_Design/03_API_事件_刷新与安全边界冻结.md",
      "heading": "## 13. Additive 字段准入 Gate",
      "line_hint": 1170
    }
  ],
  "evidence_refs": [],
  "acceptance_parent": "G-ADDITIVE",
  "work": null,
  "notes": []
}
