{
  "schema_version": "1.0.0",
  "id": "A-S3-02",
  "exact_title": "projection/rebuild/digest 证据可定位",
  "kind": "acceptance",
  "roles": [
    "acceptance"
  ],
  "lane": "acceptance",
  "lifecycle": "not_started",
  "revision": 0,
  "optional": false,
  "blocked": false,
  "hold": false,
  "change_surfaces": [],
  "source_refs": [
    {
      "path": "docs/AgentGuard_Runtime_Supervision_Console_Design/04_三线阶段实施_PR拆分与验收.md",
      "heading": "### 9.3 退出条件",
      "line_hint": 435
    }
  ],
  "evidence_refs": [],
  "acceptance_parent": "S3",
  "work": null,
  "notes": []
}
