{
  "schema_version": "1.0.0",
  "id": "A-GR05F-02",
  "exact_title": "authorization_fingerprint algorithm/version frozen",
  "kind": "acceptance",
  "roles": [
    "acceptance"
  ],
  "lane": "acceptance",
  "lifecycle": "completed",
  "revision": 1,
  "optional": false,
  "blocked": false,
  "hold": false,
  "change_surfaces": [],
  "source_refs": [
    {
      "path": "docs/AgentGuard_Runtime_Enforcement_Contract_v1_Final/06_迁移_PR与实施计划.md",
      "heading": "## 7. Core V2.1 Freeze Gate",
      "line_hint": 176
    }
  ],
  "evidence_refs": [
    "evidence/A-GR05F-02/EV-A-GR05F-02-COMMIT.json"
  ],
  "acceptance_parent": "G-R05F",
  "work": null,
  "notes": []
}
