{
  "schema_version": "1.0.0",
  "id": "A-GA-05",
  "exact_title": "replay/rebuild 后 state digest 一致",
  "kind": "acceptance",
  "roles": [
    "acceptance"
  ],
  "lane": "acceptance",
  "lifecycle": "not_started",
  "revision": 0,
  "optional": false,
  "blocked": false,
  "hold": false,
  "change_surfaces": [],
  "source_refs": [
    {
      "path": "docs/AgentGuard_Runtime_Supervision_Console_Design/04_三线阶段实施_PR拆分与验收.md",
      "heading": "### 5.1 Gate A：CT → CORE Shadow",
      "line_hint": 222
    }
  ],
  "evidence_refs": [],
  "acceptance_parent": "G-A",
  "work": null,
  "notes": []
}
