{
  "schema_version": "1.0.0",
  "id": "A-S1-12",
  "exact_title": "Task summary 留在 Header；live + derivedForDisplay 无 authority/mutation/receipt/执行步骤语义",
  "kind": "acceptance",
  "roles": [
    "acceptance"
  ],
  "lane": "acceptance",
  "lifecycle": "completed",
  "revision": 1,
  "optional": false,
  "blocked": false,
  "hold": false,
  "change_surfaces": [],
  "source_refs": [
    {
      "path": "docs/AgentGuard_Runtime_Supervision_Console_Design/04_三线阶段实施_PR拆分与验收.md",
      "heading": "### 7.4 退出条件",
      "line_hint": 347
    }
  ],
  "evidence_refs": [
    "evidence/A-S1-12/EV-A-S1-12-COMMIT.json"
  ],
  "acceptance_parent": "S1",
  "work": null,
  "notes": []
}
