{
  "schema_version": "1.0.0",
  "id": "S4",
  "exact_title": "S4 — Bound Runtime Proof / Gate B",
  "kind": "stage",
  "roles": [
    "stage"
  ],
  "lane": "stage",
  "lifecycle": "not_started",
  "revision": 0,
  "optional": false,
  "blocked": false,
  "hold": false,
  "change_surfaces": [
    "dashboard-types-mappers-store"
  ],
  "source_refs": [
    {
      "path": "docs/AgentGuard_Runtime_Supervision_Console_Design/04_三线阶段实施_PR拆分与验收.md",
      "heading": "## 10. S4 — Bound Runtime Proof / Gate B",
      "line_hint": 448
    }
  ],
  "evidence_refs": [],
  "work": null,
  "notes": []
}
